{
  "approval": null,
  "id": "graded-challenge",
  "kind": "exposure",
  "measure": "activation-0-10",
  "notes": "Структурата е по „Отвъд тревожността“ на Даниел Троев, стр. 81, с предупрежденията от стр. 84–85 и 91. Формулировките са наши и кратки, защото се четат от екран; думите на автора не са преписани. Черновата чака 6.2. Не се пуска публично без писмено съгласие и одобрение. НАЙ-РИСКОВИЯТ ФАЙЛ В ПАПКАТА. Книгата предупреждава две неща: прекалено силното предизвикване трупа ново напрежение, а при травма или силно дисрегулирана нервна система предизвикването може да засили симптомите. Затова recoveryProtocol е задължителен и схемата го налага. Липсва excludedBy — екраниращите въпроси са задача 6.4 и още не съществуват. Този файл не излиза от clinical/personal/ преди 6.3, 6.4 и поглед от юрист.",
  "preparation": [
    {
      "minDuration": 10,
      "text": {
        "bg": "Не днес, ако си изтощен или вече напрегнат. Това упражнение иска спокоен ден."
      }
    }
  ],
  "recoveryProtocol": "shoulders-belly-release",
  "schemaVersion": 1,
  "status": "draft",
  "steps": [
    {
      "minDuration": 60,
      "text": {
        "bg": "Кратко физическо усилие вкъщи — до лека умора, не до предел."
      }
    },
    {
      "minDuration": 30,
      "text": {
        "bg": "Спри и седни. Усещанията ще са познати."
      }
    },
    {
      "minDuration": 60,
      "text": {
        "bg": "Изчакай. Организмът се успокоява сам за около десет минути."
      }
    }
  ],
  "title": {
    "bg": "Малко предизвикване"
  },
  "version": 1
}
