{
  "schemaVersion": 1,
  "id": "example-screening",
  "version": 1,
  "kind": "screening",
  "status": "draft",
  "approval": null,
  "title": {
    "bg": "ПРИМЕР — не е протокол",
    "en": "EXAMPLE — not a protocol"
  },
  "steps": [
    {
      "text": {
        "bg": "Тук ще стоят екраниращите въпроси. Този файл не съдържа нито един.",
        "en": "The screening questions go here. This file contains none."
      }
    }
  ],
  "notes": "Съществува, за да има към какво да сочи excludedBy в примера, и за да не минава препратка във въздуха. Истинските критерии за изключване — сърдечни, астма, бременност, епилепсия, суицидни мисли, психоза — са задача 6.4 и ги пише квалифициран специалист, не ние. Дотогава тук няма нито един въпрос: празният файл е честен, а измислен въпрос не е."
}
