{
  "approval": null,
  "id": "humming",
  "kind": "regulation",
  "notes": "Структурата е по „Отвъд тревожността“ на Даниел Троев, стр. 116 и 134. Формулировките са наши и кратки, защото се четат от екран; думите на автора не са преписани. Черновата чака 6.2. Не се пуска публично без писмено съгласие и одобрение. Приложението не издава звук — звукът е негов.",
  "schemaVersion": 1,
  "status": "draft",
  "steps": [
    {
      "minDuration": 45,
      "text": {
        "bg": "Тананикай тихо, на един тон."
      }
    },
    {
      "minDuration": 15,
      "text": {
        "bg": "Усети къде вибрира — в гърдите, в гърлото, в лицето."
      }
    }
  ],
  "title": {
    "bg": "Тананикане"
  },
  "version": 1
}
