{
  "approval": null,
  "id": "exposure-screening",
  "kind": "screening",
  "notes": "Противопоказания, не инструмент за скрининг, и разликата е съществена. Задача 6.4 иска истински екраниращи въпроси от квалифициран специалист — тези тук не са такива и не твърдят да са. Те са предупреждението, което всяко публично упътване за физическо натоварване носи, написано като въпрос, на който човек отговаря сам. Съществуват, защото алтернативата беше експозиция без нито едно предупреждение, а тя е по-лоша. Падат в деня, в който 6.4 даде истинските.",
  "schemaVersion": 1,
  "status": "draft",
  "steps": [
    {
      "text": {
        "bg": "Имаш ли сърдечно заболяване или високо кръвно?"
      }
    },
    {
      "text": {
        "bg": "Имаш ли астма или друг проблем с дишането?"
      }
    },
    {
      "text": {
        "bg": "Бременна ли си?"
      }
    },
    {
      "text": {
        "bg": "Имаш ли епилепсия?"
      }
    },
    {
      "text": {
        "bg": "Днес изтощен ли си или вече напрегнат?"
      }
    }
  ],
  "title": {
    "bg": "Преди предизвикване"
  },
  "version": 1
}
